{"$schema":"https://json-schema.org/draft/2020-12/schema","$id":"https://github.com/Misty1up/chappy-historical-data-hub/schemas/phase6_trace_event.schema.json","type":"object","additionalProperties":false,"required":["trace_schema_version","parity_run_id","engine","layer","event_seq","canonical_ordinal","timestamp_msc","bar_seq","signal_seq","intent_seq","parity_trade_id","fields"],"properties":{"trace_schema_version":{"const":"HDH_P6_TRACE_EVENT_V1"},"parity_run_id":{"type":"string","pattern":"^HDH_P6_RUN_V1_[0-9a-f]{64}$"},"engine":{"enum":["NUMBA","MT5"]},"layer":{"enum":["INPUT","INDICATOR_FEATURE","SIGNAL","EXECUTION","RESULT"]},"event_seq":{"type":"integer","minimum":0},"canonical_ordinal":{"anyOf":[{"type":"integer","minimum":0},{"type":"null"}]},"timestamp_msc":{"anyOf":[{"type":"integer","minimum":0},{"type":"null"}]},"bar_seq":{"anyOf":[{"type":"integer","minimum":0},{"type":"null"}]},"signal_seq":{"anyOf":[{"type":"integer","minimum":0},{"type":"null"}]},"intent_seq":{"anyOf":[{"type":"integer","minimum":0},{"type":"null"}]},"parity_trade_id":{"anyOf":[{"type":"string","minLength":1},{"type":"null"}]},"fields":{"type":"object","additionalProperties":{"$ref":"#/$defs/jsonValue"}}},"$defs":{"jsonValue":{"anyOf":[{"type":"null"},{"type":"boolean"},{"type":"number"},{"type":"string"},{"type":"array","items":{"$ref":"#/$defs/jsonValue"}},{"type":"object","additionalProperties":{"$ref":"#/$defs/jsonValue"}}]}}}
