[{"bar_seq":null,"canonical_ordinal":0,"engine":"NUMBA","event_seq":0,"fields":{"ask_scaled":100002,"bid_scaled":100000,"price_scale":100000,"source_seq":0},"intent_seq":null,"layer":"INPUT","parity_run_id":"HDH_P6_RUN_V1_aaaaaaaaaaaaaaaaaaaaaaaaaaaaaaaaaaaaaaaaaaaaaaaaaaaaaaaaaaaaaaaa","parity_trade_id":null,"signal_seq":null,"timestamp_msc":1800000000000,"trace_schema_version":"HDH_P6_TRACE_EVENT_V1"},{"bar_seq":null,"canonical_ordinal":0,"engine":"NUMBA","event_seq":0,"fields":{"feature_id":"SPREAD_SCALED_V1","spread_scaled":2},"intent_seq":null,"layer":"INDICATOR_FEATURE","parity_run_id":"HDH_P6_RUN_V1_aaaaaaaaaaaaaaaaaaaaaaaaaaaaaaaaaaaaaaaaaaaaaaaaaaaaaaaaaaaaaaaa","parity_trade_id":null,"signal_seq":null,"timestamp_msc":1800000000000,"trace_schema_version":"HDH_P6_TRACE_EVENT_V1"},{"bar_seq":null,"canonical_ordinal":0,"engine":"NUMBA","event_seq":0,"fields":{"eligible":true,"entry_offset":1,"exit_offset":8,"side":"LONG","signal_rule":"ORDINAL_MOD_1024_SPREAD_PARITY_V1","spread_scaled":2},"intent_seq":null,"layer":"SIGNAL","parity_run_id":"HDH_P6_RUN_V1_aaaaaaaaaaaaaaaaaaaaaaaaaaaaaaaaaaaaaaaaaaaaaaaaaaaaaaaaaaaaaaaa","parity_trade_id":"P6_REF_TRADE_00000000","signal_seq":0,"timestamp_msc":1800000000000,"trace_schema_version":"HDH_P6_TRACE_EVENT_V1"},{"bar_seq":null,"canonical_ordinal":1,"engine":"NUMBA","event_seq":1,"fields":{"ask_scaled":100003,"bid_scaled":100001,"price_scale":100000,"source_seq":1},"intent_seq":null,"layer":"INPUT","parity_run_id":"HDH_P6_RUN_V1_aaaaaaaaaaaaaaaaaaaaaaaaaaaaaaaaaaaaaaaaaaaaaaaaaaaaaaaaaaaaaaaa","parity_trade_id":null,"signal_seq":null,"timestamp_msc":1800000000001,"trace_schema_version":"HDH_P6_TRACE_EVENT_V1"},{"bar_seq":null,"canonical_ordinal":1,"engine":"NUMBA","event_seq":1,"fields":{"feature_id":"SPREAD_SCALED_V1","spread_scaled":2},"intent_seq":null,"layer":"INDICATOR_FEATURE","parity_run_id":"HDH_P6_RUN_V1_aaaaaaaaaaaaaaaaaaaaaaaaaaaaaaaaaaaaaaaaaaaaaaaaaaaaaaaaaaaaaaaa","parity_trade_id":null,"signal_seq":null,"timestamp_msc":1800000000001,"trace_schema_version":"HDH_P6_TRACE_EVENT_V1"},{"bar_seq":null,"canonical_ordinal":1,"engine":"NUMBA","event_seq":0,"fields":{"action":"ENTRY","execution_model":"REFERENCE_MARKET_NEXT_TICK","price_scaled":100003,"price_side":"ASK","side":"LONG","signal_ordinal":0},"intent_seq":0,"layer":"EXECUTION","parity_run_id":"HDH_P6_RUN_V1_aaaaaaaaaaaaaaaaaaaaaaaaaaaaaaaaaaaaaaaaaaaaaaaaaaaaaaaaaaaaaaaa","parity_trade_id":"P6_REF_TRADE_00000000","signal_seq":0,"timestamp_msc":1800000000001,"trace_schema_version":"HDH_P6_TRACE_EVENT_V1"},{"bar_seq":null,"canonical_ordinal":2,"engine":"NUMBA","event_seq":2,"fields":{"ask_scaled":100004,"bid_scaled":100002,"price_scale":100000,"source_seq":2},"intent_seq":null,"layer":"INPUT","parity_run_id":"HDH_P6_RUN_V1_aaaaaaaaaaaaaaaaaaaaaaaaaaaaaaaaaaaaaaaaaaaaaaaaaaaaaaaaaaaaaaaa","parity_trade_id":null,"signal_seq":null,"timestamp_msc":1800000000002,"trace_schema_version":"HDH_P6_TRACE_EVENT_V1"},{"bar_seq":null,"canonical_ordinal":2,"engine":"NUMBA","event_seq":2,"fields":{"feature_id":"SPREAD_SCALED_V1","spread_scaled":2},"intent_seq":null,"layer":"INDICATOR_FEATURE","parity_run_id":"HDH_P6_RUN_V1_aaaaaaaaaaaaaaaaaaaaaaaaaaaaaaaaaaaaaaaaaaaaaaaaaaaaaaaaaaaaaaaa","parity_trade_id":null,"signal_seq":null,"timestamp_msc":1800000000002,"trace_schema_version":"HDH_P6_TRACE_EVENT_V1"},{"bar_seq":null,"canonical_ordinal":3,"engine":"NUMBA","event_seq":3,"fields":{"ask_scaled":100005,"bid_scaled":100003,"price_scale":100000,"source_seq":3},"intent_seq":null,"layer":"INPUT","parity_run_id":"HDH_P6_RUN_V1_aaaaaaaaaaaaaaaaaaaaaaaaaaaaaaaaaaaaaaaaaaaaaaaaaaaaaaaaaaaaaaaa","parity_trade_id":null,"signal_seq":null,"timestamp_msc":1800000000003,"trace_schema_version":"HDH_P6_TRACE_EVENT_V1"},{"bar_seq":null,"canonical_ordinal":3,"engine":"NUMBA","event_seq":3,"fields":{"feature_id":"SPREAD_SCALED_V1","spread_scaled":2},"intent_seq":null,"layer":"INDICATOR_FEATURE","parity_run_id":"HDH_P6_RUN_V1_aaaaaaaaaaaaaaaaaaaaaaaaaaaaaaaaaaaaaaaaaaaaaaaaaaaaaaaaaaaaaaaa","parity_trade_id":null,"signal_seq":null,"timestamp_msc":1800000000003,"trace_schema_version":"HDH_P6_TRACE_EVENT_V1"},{"bar_seq":null,"canonical_ordinal":4,"engine":"NUMBA","event_seq":4,"fields":{"ask_scaled":100006,"bid_scaled":100004,"price_scale":100000,"source_seq":4},"intent_seq":null,"layer":"INPUT","parity_run_id":"HDH_P6_RUN_V1_aaaaaaaaaaaaaaaaaaaaaaaaaaaaaaaaaaaaaaaaaaaaaaaaaaaaaaaaaaaaaaaa","parity_trade_id":null,"signal_seq":null,"timestamp_msc":1800000000004,"trace_schema_version":"HDH_P6_TRACE_EVENT_V1"},{"bar_seq":null,"canonical_ordinal":4,"engine":"NUMBA","event_seq":4,"fields":{"feature_id":"SPREAD_SCALED_V1","spread_scaled":2},"intent_seq":null,"layer":"INDICATOR_FEATURE","parity_run_id":"HDH_P6_RUN_V1_aaaaaaaaaaaaaaaaaaaaaaaaaaaaaaaaaaaaaaaaaaaaaaaaaaaaaaaaaaaaaaaa","parity_trade_id":null,"signal_seq":null,"timestamp_msc":1800000000004,"trace_schema_version":"HDH_P6_TRACE_EVENT_V1"},{"bar_seq":null,"canonical_ordinal":5,"engine":"NUMBA","event_seq":5,"fields":{"ask_scaled":100007,"bid_scaled":100005,"price_scale":100000,"source_seq":5},"intent_seq":null,"layer":"INPUT","parity_run_id":"HDH_P6_RUN_V1_aaaaaaaaaaaaaaaaaaaaaaaaaaaaaaaaaaaaaaaaaaaaaaaaaaaaaaaaaaaaaaaa","parity_trade_id":null,"signal_seq":null,"timestamp_msc":1800000000005,"trace_schema_version":"HDH_P6_TRACE_EVENT_V1"},{"bar_seq":null,"canonical_ordinal":5,"engine":"NUMBA","event_seq":5,"fields":{"feature_id":"SPREAD_SCALED_V1","spread_scaled":2},"intent_seq":null,"layer":"INDICATOR_FEATURE","parity_run_id":"HDH_P6_RUN_V1_aaaaaaaaaaaaaaaaaaaaaaaaaaaaaaaaaaaaaaaaaaaaaaaaaaaaaaaaaaaaaaaa","parity_trade_id":null,"signal_seq":null,"timestamp_msc":1800000000005,"trace_schema_version":"HDH_P6_TRACE_EVENT_V1"},{"bar_seq":null,"canonical_ordinal":6,"engine":"NUMBA","event_seq":6,"fields":{"ask_scaled":100008,"bid_scaled":100006,"price_scale":100000,"source_seq":6},"intent_seq":null,"layer":"INPUT","parity_run_id":"HDH_P6_RUN_V1_aaaaaaaaaaaaaaaaaaaaaaaaaaaaaaaaaaaaaaaaaaaaaaaaaaaaaaaaaaaaaaaa","parity_trade_id":null,"signal_seq":null,"timestamp_msc":1800000000006,"trace_schema_version":"HDH_P6_TRACE_EVENT_V1"},{"bar_seq":null,"canonical_ordinal":6,"engine":"NUMBA","event_seq":6,"fields":{"feature_id":"SPREAD_SCALED_V1","spread_scaled":2},"intent_seq":null,"layer":"INDICATOR_FEATURE","parity_run_id":"HDH_P6_RUN_V1_aaaaaaaaaaaaaaaaaaaaaaaaaaaaaaaaaaaaaaaaaaaaaaaaaaaaaaaaaaaaaaaa","parity_trade_id":null,"signal_seq":null,"timestamp_msc":1800000000006,"trace_schema_version":"HDH_P6_TRACE_EVENT_V1"},{"bar_seq":null,"canonical_ordinal":7,"engine":"NUMBA","event_seq":7,"fields":{"ask_scaled":100009,"bid_scaled":100007,"price_scale":100000,"source_seq":7},"intent_seq":null,"layer":"INPUT","parity_run_id":"HDH_P6_RUN_V1_aaaaaaaaaaaaaaaaaaaaaaaaaaaaaaaaaaaaaaaaaaaaaaaaaaaaaaaaaaaaaaaa","parity_trade_id":null,"signal_seq":null,"timestamp_msc":1800000000007,"trace_schema_version":"HDH_P6_TRACE_EVENT_V1"},{"bar_seq":null,"canonical_ordinal":7,"engine":"NUMBA","event_seq":7,"fields":{"feature_id":"SPREAD_SCALED_V1","spread_scaled":2},"intent_seq":null,"layer":"INDICATOR_FEATURE","parity_run_id":"HDH_P6_RUN_V1_aaaaaaaaaaaaaaaaaaaaaaaaaaaaaaaaaaaaaaaaaaaaaaaaaaaaaaaaaaaaaaaa","parity_trade_id":null,"signal_seq":null,"timestamp_msc":1800000000007,"trace_schema_version":"HDH_P6_TRACE_EVENT_V1"},{"bar_seq":null,"canonical_ordinal":8,"engine":"NUMBA","event_seq":8,"fields":{"ask_scaled":100010,"bid_scaled":100008,"price_scale":100000,"source_seq":8},"intent_seq":null,"layer":"INPUT","parity_run_id":"HDH_P6_RUN_V1_aaaaaaaaaaaaaaaaaaaaaaaaaaaaaaaaaaaaaaaaaaaaaaaaaaaaaaaaaaaaaaaa","parity_trade_id":null,"signal_seq":null,"timestamp_msc":1800000000008,"trace_schema_version":"HDH_P6_TRACE_EVENT_V1"},{"bar_seq":null,"canonical_ordinal":8,"engine":"NUMBA","event_seq":8,"fields":{"feature_id":"SPREAD_SCALED_V1","spread_scaled":2},"intent_seq":null,"layer":"INDICATOR_FEATURE","parity_run_id":"HDH_P6_RUN_V1_aaaaaaaaaaaaaaaaaaaaaaaaaaaaaaaaaaaaaaaaaaaaaaaaaaaaaaaaaaaaaaaa","parity_trade_id":null,"signal_seq":null,"timestamp_msc":1800000000008,"trace_schema_version":"HDH_P6_TRACE_EVENT_V1"},{"bar_seq":null,"canonical_ordinal":8,"engine":"NUMBA","event_seq":1,"fields":{"action":"EXIT","execution_model":"REFERENCE_MARKET_FIXED_EXIT","price_scaled":100008,"price_side":"BID","side":"LONG","signal_ordinal":0},"intent_seq":1,"layer":"EXECUTION","parity_run_id":"HDH_P6_RUN_V1_aaaaaaaaaaaaaaaaaaaaaaaaaaaaaaaaaaaaaaaaaaaaaaaaaaaaaaaaaaaaaaaa","parity_trade_id":"P6_REF_TRADE_00000000","signal_seq":0,"timestamp_msc":1800000000008,"trace_schema_version":"HDH_P6_TRACE_EVENT_V1"},{"bar_seq":null,"canonical_ordinal":8,"engine":"NUMBA","event_seq":0,"fields":{"entry_price_scaled":100003,"exit_price_scaled":100008,"pnl_scaled":5,"result_type":"TRADE","side":"LONG"},"intent_seq":null,"layer":"RESULT","parity_run_id":"HDH_P6_RUN_V1_aaaaaaaaaaaaaaaaaaaaaaaaaaaaaaaaaaaaaaaaaaaaaaaaaaaaaaaaaaaaaaaa","parity_trade_id":"P6_REF_TRADE_00000000","signal_seq":0,"timestamp_msc":1800000000008,"trace_schema_version":"HDH_P6_TRACE_EVENT_V1"},{"bar_seq":null,"canonical_ordinal":8,"engine":"NUMBA","event_seq":1,"fields":{"result_type":"AGGREGATE","total_pnl_scaled":5,"trade_count":1},"intent_seq":null,"layer":"RESULT","parity_run_id":"HDH_P6_RUN_V1_aaaaaaaaaaaaaaaaaaaaaaaaaaaaaaaaaaaaaaaaaaaaaaaaaaaaaaaaaaaaaaaa","parity_trade_id":null,"signal_seq":null,"timestamp_msc":1800000000008,"trace_schema_version":"HDH_P6_TRACE_EVENT_V1"}]